{
  "$schema": "http://json-schema.org/draft-07/schema#",
  "$id": "urn:javis-dog:jgr:conformance:analytics:vector:adr-0013",
  "title": "JGR v0.1 usage analytics conformance vector (ADR-0013 read model)",
  "description": "One black-box case for the JD-M08 read model: seeded workspaces, projects and stored events with received_at relative to a pinned now -> partial expectations on usage(workspaceId, { days, projectId, now }). Derived from ADR-0013 and JGR spec v0.1 §3, §4, §6 and §10. See README.md for runner semantics.",
  "type": "object",
  "additionalProperties": false,
  "required": ["description", "contract", "now", "workspaces", "events", "query", "expect"],
  "properties": {
    "$schema": { "type": "string" },
    "description": { "type": "string", "minLength": 1 },
    "contract": {
      "description": "Contract text the expectation is derived from (ADR-0013 section, types.ts comment, spec section, sprint review focus).",
      "type": "string",
      "minLength": 1
    },
    "now": {
      "description": "Pinned instant passed as usage(workspaceId, { now }). Every offset in the vector is relative to it.",
      "$ref": "#/definitions/instant"
    },
    "workspaces": {
      "description": "Workspaces to create, keyed by a vector-local key (A, B, ...).",
      "type": "object",
      "minProperties": 1,
      "propertyNames": { "pattern": "^[A-Z]$" },
      "additionalProperties": { "$ref": "#/definitions/workspace" }
    },
    "events": {
      "description": "Rows to insert into the event store, in any order (the runner never relies on array order).",
      "type": "array",
      "items": { "$ref": "#/definitions/event" }
    },
    "query": { "$ref": "#/definitions/query" },
    "expect": { "$ref": "#/definitions/expect" }
  },
  "definitions": {
    "instant": {
      "type": "string",
      "pattern": "^\\d{4}-\\d{2}-\\d{2}T\\d{2}:\\d{2}:\\d{2}(\\.\\d{1,3})?Z$"
    },
    "date": {
      "description": "UTC calendar date, YYYY-MM-DD (types.ts).",
      "type": "string",
      "pattern": "^\\d{4}-\\d{2}-\\d{2}$"
    },
    "ref": {
      "description": "Opaque identifier, spec §3.",
      "type": "string",
      "pattern": "^[A-Za-z0-9_:-]{1,128}$"
    },
    "slug": { "type": "string", "pattern": "^[a-z0-9][a-z0-9-]{0,62}$" },
    "workspaceKey": { "type": "string", "pattern": "^[A-Z]$" },
    "status": {
      "description": "Spec §5 status values. stale is never a status.",
      "enum": ["working", "waiting", "idle", "blocked", "failed", "completed"]
    },
    "eventType": {
      "description": "Spec §4 core type or x.<vendor>.<name> extension.",
      "type": "string",
      "pattern": "^(session\\.started|session\\.ended|agent\\.started|agent\\.stopped|heartbeat|task\\.started|task\\.completed|task\\.failed|attention\\.requested|usage\\.reported|error|x\\.[a-z0-9-]+\\.[a-z0-9_.-]+)$"
    },
    "pastOffsetMs": {
      "description": "Milliseconds relative to now; 0 or negative (before now).",
      "type": "integer",
      "maximum": 0
    },
    "count": { "type": "integer", "minimum": 0 },
    "costUsd": {
      "description": "Compared with an absolute tolerance of 1e-9 (README: Comparison).",
      "type": "number",
      "minimum": 0
    },
    "workspace": {
      "type": "object",
      "additionalProperties": false,
      "required": ["name", "projects"],
      "properties": {
        "name": { "type": "string", "minLength": 1 },
        "projects": { "type": "array", "items": { "$ref": "#/definitions/project" } }
      }
    },
    "project": {
      "type": "object",
      "additionalProperties": false,
      "required": ["slug", "name"],
      "properties": {
        "slug": { "$ref": "#/definitions/slug" },
        "name": { "type": "string", "minLength": 1 }
      }
    },
    "usageDelta": {
      "description": "Spec §6 usage_delta.",
      "type": "object",
      "additionalProperties": false,
      "minProperties": 1,
      "properties": {
        "input_tokens": { "$ref": "#/definitions/count" },
        "output_tokens": { "$ref": "#/definitions/count" },
        "cache_read_tokens": { "$ref": "#/definitions/count" },
        "cache_write_tokens": { "$ref": "#/definitions/count" },
        "reasoning_tokens": { "$ref": "#/definitions/count" },
        "cost_usd": { "type": "number", "minimum": 0 },
        "model": { "type": "string", "minLength": 1 },
        "estimated": { "type": "boolean" }
      }
    },
    "attributes": {
      "type": "object",
      "maxProperties": 16,
      "additionalProperties": {
        "oneOf": [
          { "type": "string", "maxLength": 128 },
          { "type": "number" },
          { "type": "boolean" }
        ]
      }
    },
    "event": {
      "type": "object",
      "additionalProperties": false,
      "required": [
        "workspace",
        "project",
        "thread_ref",
        "type",
        "sequence",
        "receivedOffsetMs",
        "receivedAtUtc"
      ],
      "properties": {
        "workspace": { "$ref": "#/definitions/workspaceKey" },
        "project": { "$ref": "#/definitions/slug" },
        "thread_ref": { "$ref": "#/definitions/ref" },
        "agent_ref": { "$ref": "#/definitions/ref" },
        "type": { "$ref": "#/definitions/eventType" },
        "status": { "$ref": "#/definitions/status" },
        "sequence": { "$ref": "#/definitions/count" },
        "receivedOffsetMs": {
          "description": "received_at = now + offset. Normative.",
          "$ref": "#/definitions/pastOffsetMs"
        },
        "receivedAtUtc": {
          "description": "Informative: now + receivedOffsetMs written out, for reviewers. The runner checks it equals now + receivedOffsetMs and reports BLOCKED (vector defect) otherwise.",
          "$ref": "#/definitions/instant"
        },
        "occurredOffsetMs": {
          "description": "occurred_at = now + offset. Omitted: equal to receivedOffsetMs. May be later than received_at by at most 5 minutes (spec §10).",
          "type": "integer"
        },
        "usage_delta": { "$ref": "#/definitions/usageDelta" },
        "attributes": { "$ref": "#/definitions/attributes" }
      }
    },
    "query": {
      "description": "The call under test: usage(<id of workspace>, { days?, projectId?, now }).",
      "type": "object",
      "additionalProperties": false,
      "required": ["workspace"],
      "properties": {
        "workspace": { "$ref": "#/definitions/workspaceKey" },
        "days": {
          "description": "Passed as the days option; omitted -> the option is omitted (default 14). Integers only: ADR-0013 states no rounding for fractions (README A4).",
          "type": "integer"
        },
        "project": {
          "description": "Slug of a project of the queried workspace; its id is passed as projectId.",
          "$ref": "#/definitions/slug"
        },
        "foreignProject": {
          "description": "A project of another workspace; its id is passed as projectId.",
          "type": "object",
          "additionalProperties": false,
          "required": ["workspace", "slug"],
          "properties": {
            "workspace": { "$ref": "#/definitions/workspaceKey" },
            "slug": { "$ref": "#/definitions/slug" }
          }
        }
      },
      "not": { "required": ["project", "foreignProject"] }
    },
    "dayExpect": {
      "type": "object",
      "additionalProperties": false,
      "required": ["date"],
      "properties": {
        "date": { "$ref": "#/definitions/date" },
        "inputTokens": { "$ref": "#/definitions/count" },
        "outputTokens": { "$ref": "#/definitions/count" },
        "cacheReadTokens": { "$ref": "#/definitions/count" },
        "cacheWriteTokens": { "$ref": "#/definitions/count" },
        "estimatedCostUsd": { "$ref": "#/definitions/costUsd" },
        "reports": { "$ref": "#/definitions/count" },
        "tasksCompleted": { "$ref": "#/definitions/count" },
        "tasksFailed": { "$ref": "#/definitions/count" }
      }
    },
    "totalsExpect": {
      "type": "object",
      "additionalProperties": false,
      "properties": {
        "inputTokens": { "$ref": "#/definitions/count" },
        "outputTokens": { "$ref": "#/definitions/count" },
        "cacheReadTokens": { "$ref": "#/definitions/count" },
        "cacheWriteTokens": { "$ref": "#/definitions/count" },
        "estimatedCostUsd": { "$ref": "#/definitions/costUsd" },
        "reports": { "$ref": "#/definitions/count" },
        "tasksCompleted": { "$ref": "#/definitions/count" },
        "tasksFailed": { "$ref": "#/definitions/count" }
      }
    },
    "modelExpect": {
      "type": "object",
      "additionalProperties": false,
      "required": ["model"],
      "properties": {
        "model": { "type": ["string", "null"] },
        "inputTokens": { "$ref": "#/definitions/count" },
        "outputTokens": { "$ref": "#/definitions/count" },
        "cacheReadTokens": { "$ref": "#/definitions/count" },
        "cacheWriteTokens": { "$ref": "#/definitions/count" },
        "estimatedCostUsd": { "$ref": "#/definitions/costUsd" },
        "reports": { "$ref": "#/definitions/count" }
      }
    },
    "projectExpect": {
      "type": "object",
      "additionalProperties": false,
      "required": ["slug"],
      "properties": {
        "slug": { "$ref": "#/definitions/slug" },
        "name": { "type": "string" },
        "projectId": {
          "description": "$PROJECT_ID:<workspace key>:<slug>, replaced by the id the runner assigned.",
          "type": "string",
          "pattern": "^\\$PROJECT_ID:[A-Z]:[a-z0-9][a-z0-9-]{0,62}$"
        },
        "inputTokens": { "$ref": "#/definitions/count" },
        "outputTokens": { "$ref": "#/definitions/count" },
        "cacheReadTokens": { "$ref": "#/definitions/count" },
        "cacheWriteTokens": { "$ref": "#/definitions/count" },
        "estimatedCostUsd": { "$ref": "#/definitions/costUsd" },
        "reports": { "$ref": "#/definitions/count" }
      }
    },
    "expect": {
      "description": "Partial expectations: a key that is omitted is not checked (README: Comparison).",
      "type": "object",
      "additionalProperties": false,
      "required": ["from", "to", "daysLength", "absentStrings"],
      "properties": {
        "from": { "$ref": "#/definitions/date" },
        "to": { "$ref": "#/definitions/date" },
        "daysLength": { "type": "integer", "minimum": 1, "maximum": 30 },
        "days": {
          "description": "Each entry matches exactly one element of result.days by date; listed fields compared.",
          "type": "array",
          "items": { "$ref": "#/definitions/dayExpect" }
        },
        "otherDaysZero": {
          "description": "true: every element of result.days whose date is not listed in days has all eight numeric fields equal to 0.",
          "const": true
        },
        "totals": { "$ref": "#/definitions/totalsExpect" },
        "byModelLength": { "$ref": "#/definitions/count" },
        "byModelOrder": {
          "description": "result.byModel mapped to model equals this list exactly, in order.",
          "type": "array",
          "items": { "type": ["string", "null"] }
        },
        "byModel": {
          "description": "Each entry matches exactly one element of result.byModel by model (null matches null).",
          "type": "array",
          "items": { "$ref": "#/definitions/modelExpect" }
        },
        "byProjectLength": { "$ref": "#/definitions/count" },
        "byProjectOrder": {
          "description": "result.byProject mapped to slug equals this list exactly, in order.",
          "type": "array",
          "items": { "$ref": "#/definitions/slug" }
        },
        "byProject": {
          "description": "Each entry matches exactly one element of result.byProject by slug.",
          "type": "array",
          "items": { "$ref": "#/definitions/projectExpect" }
        },
        "lastReportOffsetMs": {
          "description": "null: lastReportAt is null. Number: lastReportAt denotes now + offset.",
          "oneOf": [{ "$ref": "#/definitions/pastOffsetMs" }, { "type": "null" }]
        },
        "absentStrings": {
          "description": "Substrings that MUST NOT occur in JSON.stringify(result). $PROJECT_ID:<workspace key>:<slug> is replaced by that project's id.",
          "type": "array",
          "items": { "type": "string", "minLength": 3 }
        }
      }
    }
  }
}
