{
  "$schema": "./schema.json",
  "description": "days = 0 is clamped to 1: one day (today), yesterday excluded.",
  "contract": "ADR-0013 Decision outcome: Read model (\"days is clamped to 1-30\")",
  "now": "2026-10-28T12:00:00.000Z",
  "workspaces": {
    "A": {
      "name": "Workspace A",
      "projects": [
        {
          "slug": "web",
          "name": "Web app"
        }
      ]
    }
  },
  "events": [
    {
      "workspace": "A",
      "project": "web",
      "thread_ref": "cc_t07",
      "type": "usage.reported",
      "sequence": 2,
      "receivedOffsetMs": -39600000,
      "receivedAtUtc": "2026-10-28T01:00:00.000Z",
      "usage_delta": {
        "input_tokens": 9,
        "model": "claude-opus-5-5"
      }
    },
    {
      "workspace": "A",
      "project": "web",
      "thread_ref": "cc_t07",
      "type": "usage.reported",
      "sequence": 1,
      "receivedOffsetMs": -46800000,
      "receivedAtUtc": "2026-10-27T23:00:00.000Z",
      "usage_delta": {
        "input_tokens": 99,
        "model": "claude-opus-5-5"
      }
    }
  ],
  "query": {
    "workspace": "A",
    "days": 0
  },
  "expect": {
    "from": "2026-10-28",
    "to": "2026-10-28",
    "daysLength": 1,
    "days": [
      {
        "date": "2026-10-28",
        "inputTokens": 9,
        "outputTokens": 0,
        "cacheReadTokens": 0,
        "cacheWriteTokens": 0,
        "estimatedCostUsd": 0,
        "reports": 1,
        "tasksCompleted": 0,
        "tasksFailed": 0
      }
    ],
    "totals": {
      "inputTokens": 9,
      "outputTokens": 0,
      "cacheReadTokens": 0,
      "cacheWriteTokens": 0,
      "estimatedCostUsd": 0,
      "reports": 1,
      "tasksCompleted": 0,
      "tasksFailed": 0
    },
    "lastReportOffsetMs": -39600000,
    "absentStrings": []
  }
}
