{
  "$schema": "./schema.json",
  "description": "byModel groups by usage_delta.model, with null for reports that carried none, sorted by input + output tokens descending: cache tokens and cost do not affect the order (the model with the most cache and cost is last).",
  "contract": "ADR-0013 Decision outcome: Read model (totals by model); types.ts byModel \"Sorted by input + output tokens, descending; model is null when reports carried none\"",
  "now": "2026-10-28T12:00:00.000Z",
  "workspaces": {
    "A": {
      "name": "Workspace A",
      "projects": [
        {
          "slug": "web",
          "name": "Web app"
        },
        {
          "slug": "api",
          "name": "API"
        }
      ]
    }
  },
  "events": [
    {
      "workspace": "A",
      "project": "web",
      "thread_ref": "cc_t16a",
      "type": "usage.reported",
      "sequence": 1,
      "receivedOffsetMs": -698400000,
      "receivedAtUtc": "2026-10-20T10:00:00.000Z",
      "usage_delta": {
        "input_tokens": 600,
        "output_tokens": 300,
        "cache_read_tokens": 10,
        "cost_usd": 0.6,
        "model": "claude-opus-5-5"
      }
    },
    {
      "workspace": "A",
      "project": "api",
      "thread_ref": "cc_t16b",
      "type": "usage.reported",
      "sequence": 1,
      "receivedOffsetMs": -93600000,
      "receivedAtUtc": "2026-10-27T10:00:00.000Z",
      "usage_delta": {
        "input_tokens": 400,
        "output_tokens": 200,
        "cost_usd": 0.4,
        "model": "claude-opus-5-5"
      }
    },
    {
      "workspace": "A",
      "project": "web",
      "thread_ref": "cc_t16a",
      "type": "usage.reported",
      "sequence": 2,
      "receivedOffsetMs": -612000000,
      "receivedAtUtc": "2026-10-21T10:00:00.000Z",
      "usage_delta": {
        "input_tokens": 500,
        "output_tokens": 50,
        "cost_usd": 0.2
      }
    },
    {
      "workspace": "A",
      "project": "api",
      "thread_ref": "cc_t16b",
      "type": "usage.reported",
      "sequence": 2,
      "receivedOffsetMs": -90000000,
      "receivedAtUtc": "2026-10-27T11:00:00.000Z",
      "usage_delta": {
        "input_tokens": 200,
        "output_tokens": 50,
        "estimated": true
      }
    },
    {
      "workspace": "A",
      "project": "web",
      "thread_ref": "cc_t16c",
      "type": "usage.reported",
      "sequence": 1,
      "receivedOffsetMs": -525600000,
      "receivedAtUtc": "2026-10-22T10:00:00.000Z",
      "usage_delta": {
        "input_tokens": 50,
        "output_tokens": 50,
        "cache_read_tokens": 900000,
        "cache_write_tokens": 70000,
        "cost_usd": 5.0,
        "model": "gpt-5-codex"
      }
    },
    {
      "workspace": "A",
      "project": "api",
      "thread_ref": "cc_t16d",
      "type": "usage.reported",
      "sequence": 1,
      "receivedOffsetMs": -7200000,
      "receivedAtUtc": "2026-10-28T10:00:00.000Z",
      "usage_delta": {
        "input_tokens": 300,
        "output_tokens": 600,
        "model": "gemini-3-pro"
      }
    }
  ],
  "query": {
    "workspace": "A",
    "days": 14
  },
  "expect": {
    "from": "2026-10-15",
    "to": "2026-10-28",
    "daysLength": 14,
    "totals": {
      "inputTokens": 2050,
      "outputTokens": 1250,
      "cacheReadTokens": 900010,
      "cacheWriteTokens": 70000,
      "estimatedCostUsd": 6.2,
      "reports": 6,
      "tasksCompleted": 0,
      "tasksFailed": 0
    },
    "byModelLength": 4,
    "byModelOrder": ["claude-opus-5-5", "gemini-3-pro", null, "gpt-5-codex"],
    "byModel": [
      {
        "model": "claude-opus-5-5",
        "inputTokens": 1000,
        "outputTokens": 500,
        "cacheReadTokens": 10,
        "cacheWriteTokens": 0,
        "estimatedCostUsd": 1.0,
        "reports": 2
      },
      {
        "model": "gemini-3-pro",
        "inputTokens": 300,
        "outputTokens": 600,
        "cacheReadTokens": 0,
        "cacheWriteTokens": 0,
        "estimatedCostUsd": 0,
        "reports": 1
      },
      {
        "model": null,
        "inputTokens": 700,
        "outputTokens": 100,
        "cacheReadTokens": 0,
        "cacheWriteTokens": 0,
        "estimatedCostUsd": 0.2,
        "reports": 2
      },
      {
        "model": "gpt-5-codex",
        "inputTokens": 50,
        "outputTokens": 50,
        "cacheReadTokens": 900000,
        "cacheWriteTokens": 70000,
        "estimatedCostUsd": 5.0,
        "reports": 1
      }
    ],
    "lastReportOffsetMs": -7200000,
    "absentStrings": []
  }
}
