{
  "$schema": "./schema.json",
  "description": "now is exactly 00:00:00.000 UTC and days = 1: the range is that single new day; a report 1 ms earlier belongs to the previous day and is excluded.",
  "contract": "ADR-0013 Decision outcome: Read model (per UTC day, days 1-30, now option)",
  "now": "2026-10-28T00:00:00.000Z",
  "workspaces": {
    "A": {
      "name": "Workspace A",
      "projects": [
        {
          "slug": "web",
          "name": "Web app"
        }
      ]
    }
  },
  "events": [
    {
      "workspace": "A",
      "project": "web",
      "thread_ref": "cc_t02",
      "type": "usage.reported",
      "sequence": 2,
      "receivedOffsetMs": 0,
      "receivedAtUtc": "2026-10-28T00:00:00.000Z",
      "usage_delta": {
        "input_tokens": 5,
        "output_tokens": 1,
        "model": "claude-opus-5-5"
      }
    },
    {
      "workspace": "A",
      "project": "web",
      "thread_ref": "cc_t02",
      "type": "usage.reported",
      "sequence": 1,
      "receivedOffsetMs": -1,
      "receivedAtUtc": "2026-10-27T23:59:59.999Z",
      "usage_delta": {
        "input_tokens": 7,
        "output_tokens": 2,
        "model": "claude-opus-5-5"
      }
    },
    {
      "workspace": "A",
      "project": "web",
      "thread_ref": "cc_t02b",
      "type": "task.completed",
      "sequence": 1,
      "receivedOffsetMs": -1,
      "receivedAtUtc": "2026-10-27T23:59:59.999Z"
    }
  ],
  "query": {
    "workspace": "A",
    "days": 1
  },
  "expect": {
    "from": "2026-10-28",
    "to": "2026-10-28",
    "daysLength": 1,
    "days": [
      {
        "date": "2026-10-28",
        "inputTokens": 5,
        "outputTokens": 1,
        "cacheReadTokens": 0,
        "cacheWriteTokens": 0,
        "estimatedCostUsd": 0,
        "reports": 1,
        "tasksCompleted": 0,
        "tasksFailed": 0
      }
    ],
    "totals": {
      "inputTokens": 5,
      "outputTokens": 1,
      "cacheReadTokens": 0,
      "cacheWriteTokens": 0,
      "estimatedCostUsd": 0,
      "reports": 1,
      "tasksCompleted": 0,
      "tasksFailed": 0
    },
    "byModelLength": 1,
    "lastReportOffsetMs": 0,
    "absentStrings": []
  }
}
