{
  "$schema": "./schema.json",
  "description": "A usage report at 23:59:59.999 UTC and one at 00:00:00.000 UTC land on different days; the same holds for task outcomes.",
  "contract": "ADR-0013 Decision outcome: Read model (per UTC day); SPRINT-04b Review focus (23:59:59.999 / 00:00:00.000)",
  "now": "2026-10-28T12:00:00.000Z",
  "workspaces": {
    "A": {
      "name": "Workspace A",
      "projects": [
        {
          "slug": "web",
          "name": "Web app"
        }
      ]
    }
  },
  "events": [
    {
      "workspace": "A",
      "project": "web",
      "thread_ref": "cc_t01",
      "type": "usage.reported",
      "sequence": 1,
      "receivedOffsetMs": -43200001,
      "receivedAtUtc": "2026-10-27T23:59:59.999Z",
      "usage_delta": {
        "input_tokens": 100,
        "output_tokens": 10,
        "cost_usd": 0.01,
        "model": "claude-opus-5-5"
      }
    },
    {
      "workspace": "A",
      "project": "web",
      "thread_ref": "cc_t01",
      "type": "usage.reported",
      "sequence": 2,
      "receivedOffsetMs": -43200000,
      "receivedAtUtc": "2026-10-28T00:00:00.000Z",
      "usage_delta": {
        "input_tokens": 200,
        "output_tokens": 20,
        "cost_usd": 0.02,
        "model": "claude-opus-5-5"
      }
    },
    {
      "workspace": "A",
      "project": "web",
      "thread_ref": "cc_t01b",
      "type": "task.completed",
      "sequence": 1,
      "receivedOffsetMs": -43200001,
      "receivedAtUtc": "2026-10-27T23:59:59.999Z",
      "attributes": {
        "tool_name": "Edit"
      }
    },
    {
      "workspace": "A",
      "project": "web",
      "thread_ref": "cc_t01b",
      "type": "task.failed",
      "sequence": 2,
      "receivedOffsetMs": -43200000,
      "receivedAtUtc": "2026-10-28T00:00:00.000Z",
      "attributes": {
        "tool_name": "Bash"
      }
    }
  ],
  "query": {
    "workspace": "A",
    "days": 14
  },
  "expect": {
    "from": "2026-10-15",
    "to": "2026-10-28",
    "daysLength": 14,
    "days": [
      {
        "date": "2026-10-27",
        "inputTokens": 100,
        "outputTokens": 10,
        "cacheReadTokens": 0,
        "cacheWriteTokens": 0,
        "estimatedCostUsd": 0.01,
        "reports": 1,
        "tasksCompleted": 1,
        "tasksFailed": 0
      },
      {
        "date": "2026-10-28",
        "inputTokens": 200,
        "outputTokens": 20,
        "cacheReadTokens": 0,
        "cacheWriteTokens": 0,
        "estimatedCostUsd": 0.02,
        "reports": 1,
        "tasksCompleted": 0,
        "tasksFailed": 1
      }
    ],
    "otherDaysZero": true,
    "totals": {
      "inputTokens": 300,
      "outputTokens": 30,
      "cacheReadTokens": 0,
      "cacheWriteTokens": 0,
      "estimatedCostUsd": 0.03,
      "reports": 2,
      "tasksCompleted": 1,
      "tasksFailed": 1
    },
    "byModelLength": 1,
    "byModel": [
      {
        "model": "claude-opus-5-5",
        "inputTokens": 300,
        "outputTokens": 30,
        "cacheReadTokens": 0,
        "cacheWriteTokens": 0,
        "estimatedCostUsd": 0.03,
        "reports": 2
      }
    ],
    "lastReportOffsetMs": -43200000,
    "absentStrings": []
  }
}
