{
  "$schema": "./schema.json",
  "description": "Without a project filter only the queried workspace counts: workspace B has a project with the same slug web, the same model, newer and larger reports and more tasks; none of it appears in A.",
  "contract": "ADR-0013 Decision outcome: Read model (workspaceId); SPRINT-04b Global constraints (Workspace isolation)",
  "now": "2026-10-28T12:00:00.000Z",
  "workspaces": {
    "A": {
      "name": "Workspace A",
      "projects": [
        {
          "slug": "web",
          "name": "Web app"
        }
      ]
    },
    "B": {
      "name": "Workspace B",
      "projects": [
        {
          "slug": "web",
          "name": "B20 web marker"
        },
        {
          "slug": "api",
          "name": "B20 api marker"
        }
      ]
    }
  },
  "events": [
    {
      "workspace": "A",
      "project": "web",
      "thread_ref": "cc_a20",
      "type": "usage.reported",
      "sequence": 1,
      "receivedOffsetMs": -93600000,
      "receivedAtUtc": "2026-10-27T10:00:00.000Z",
      "usage_delta": {
        "input_tokens": 100,
        "output_tokens": 10,
        "cost_usd": 0.1,
        "model": "claude-opus-5-5"
      }
    },
    {
      "workspace": "A",
      "project": "web",
      "thread_ref": "cc_a20",
      "type": "task.completed",
      "sequence": 2,
      "receivedOffsetMs": -91800000,
      "receivedAtUtc": "2026-10-27T10:30:00.000Z"
    },
    {
      "workspace": "B",
      "project": "web",
      "thread_ref": "cc_b20",
      "type": "usage.reported",
      "sequence": 1,
      "receivedOffsetMs": -90000000,
      "receivedAtUtc": "2026-10-27T11:00:00.000Z",
      "usage_delta": {
        "input_tokens": 9000,
        "output_tokens": 900,
        "cost_usd": 9.0,
        "model": "claude-opus-5-5"
      }
    },
    {
      "workspace": "B",
      "project": "web",
      "thread_ref": "cc_b20",
      "type": "usage.reported",
      "sequence": 2,
      "receivedOffsetMs": -3600000,
      "receivedAtUtc": "2026-10-28T11:00:00.000Z",
      "usage_delta": {
        "input_tokens": 8000,
        "model": "x-b20-model"
      }
    },
    {
      "workspace": "B",
      "project": "api",
      "thread_ref": "cc_b20api",
      "type": "usage.reported",
      "sequence": 1,
      "receivedOffsetMs": -1800000,
      "receivedAtUtc": "2026-10-28T11:30:00.000Z",
      "usage_delta": {
        "input_tokens": 7000,
        "model": "x-b20-model"
      }
    },
    {
      "workspace": "B",
      "project": "web",
      "thread_ref": "cc_b20",
      "type": "task.completed",
      "sequence": 3,
      "receivedOffsetMs": -3000000,
      "receivedAtUtc": "2026-10-28T11:10:00.000Z"
    },
    {
      "workspace": "B",
      "project": "web",
      "thread_ref": "cc_b20",
      "type": "task.completed",
      "sequence": 4,
      "receivedOffsetMs": -2400000,
      "receivedAtUtc": "2026-10-28T11:20:00.000Z"
    },
    {
      "workspace": "B",
      "project": "web",
      "thread_ref": "cc_b20",
      "type": "task.completed",
      "sequence": 5,
      "receivedOffsetMs": -1200000,
      "receivedAtUtc": "2026-10-28T11:40:00.000Z"
    },
    {
      "workspace": "B",
      "project": "api",
      "thread_ref": "cc_b20api",
      "type": "task.failed",
      "sequence": 2,
      "receivedOffsetMs": -900000,
      "receivedAtUtc": "2026-10-28T11:45:00.000Z"
    }
  ],
  "query": {
    "workspace": "A",
    "days": 14
  },
  "expect": {
    "from": "2026-10-15",
    "to": "2026-10-28",
    "daysLength": 14,
    "days": [
      {
        "date": "2026-10-27",
        "inputTokens": 100,
        "outputTokens": 10,
        "cacheReadTokens": 0,
        "cacheWriteTokens": 0,
        "estimatedCostUsd": 0.1,
        "reports": 1,
        "tasksCompleted": 1,
        "tasksFailed": 0
      }
    ],
    "otherDaysZero": true,
    "totals": {
      "inputTokens": 100,
      "outputTokens": 10,
      "cacheReadTokens": 0,
      "cacheWriteTokens": 0,
      "estimatedCostUsd": 0.1,
      "reports": 1,
      "tasksCompleted": 1,
      "tasksFailed": 0
    },
    "byModelLength": 1,
    "byModel": [
      {
        "model": "claude-opus-5-5",
        "inputTokens": 100,
        "outputTokens": 10,
        "cacheReadTokens": 0,
        "cacheWriteTokens": 0,
        "estimatedCostUsd": 0.1,
        "reports": 1
      }
    ],
    "byProjectLength": 1,
    "byProject": [
      {
        "slug": "web",
        "name": "Web app",
        "projectId": "$PROJECT_ID:A:web",
        "inputTokens": 100,
        "outputTokens": 10,
        "cacheReadTokens": 0,
        "cacheWriteTokens": 0,
        "estimatedCostUsd": 0.1,
        "reports": 1
      }
    ],
    "lastReportOffsetMs": -93600000,
    "absentStrings": [
      "x-b20-model",
      "B20 web marker",
      "B20 api marker",
      "$PROJECT_ID:B:web",
      "$PROJECT_ID:B:api"
    ]
  }
}
